{
  "active_projects": [],
  "blocked_projects": [],
  "created_at": "2026-07-17T16:47:46Z",
  "last_health_check": "2026-09-01T02:30:36Z",
  "owner_skill": "creator-workspace-manager",
  "privacy_class": "repository_workflow_state",
  "schema_version": "0.4.0",
  "state_divergence": {
    "level": "green",
    "notes": "Derived 0 red and 0 amber signal(s); score=0. Evidence: .creator/health/health-report.json.",
    "score": 0
  },
  "updated_at": "2026-09-01T02:30:36Z"
}
